{
  "$schema": "./EPISODE_REGISTRY.schema.json",
  "schemaVersion": "1.0.0",
  "registryId": "SCZN3_EPISODE_REGISTRY",
  "authority": "single-authoritative-owner",
  "status": "authoritative",
  "effectiveDate": "2026-08-06",
  "governance": {
    "rule": "No episode may be created until the previous episode has been authoritatively closed.",
    "lastClosedEpisode": 58,
    "activeEpisode": null,
    "nextEpisodeNumber": 59,
    "governanceEffectiveAfterEpisode": 51
  },
  "historicalCandidateMilestones": [
    {"milestone":"M-001","title":"First Stable Zeroing Pipeline","date":"2026-04-25 candidate","episodeNumber":null},
    {"milestone":"M-002","title":"Backend Authority","date":"2026-06-09/2026-06-18","episodeNumber":null},
    {"milestone":"M-003","title":"Mission Family Routing","date":"2026-06-26","episodeNumber":null},
    {"milestone":"M-004","title":"Governed Target Registry","date":"2026-06-30","episodeNumber":null},
    {"milestone":"M-005","title":"Active Calculation Context","date":"2026-07-08","episodeNumber":null},
    {"milestone":"M-006","title":"Explainable Scoring","date":"2026-07-08/2026-07-11","episodeNumber":null},
    {"milestone":"M-008","title":"Universal SEC Architecture Baseline","date":"2026-07-14","episodeNumber":null}
  ],
  "episodes": [
    {"episodeNumber":1,"title":null,"status":"historical-unresolved","date":null,"checkpoint":null,"zip":null,"commits":[],"productionRelease":null,"archiveLocation":null,"evidence":["No authoritative Episode 1 record found"]},
    {"episodeNumber":2,"title":null,"status":"historical-unresolved","date":null,"checkpoint":null,"zip":null,"commits":[],"productionRelease":null,"archiveLocation":null,"evidence":["No authoritative Episode 2 record found"]},
    {"episodeNumber":3,"title":null,"status":"historical-unresolved","date":null,"checkpoint":null,"zip":null,"commits":[],"productionRelease":null,"archiveLocation":null,"evidence":["No authoritative Episode 3 record found"]},
    {"episodeNumber":4,"title":null,"status":"historical-unresolved","date":null,"checkpoint":null,"zip":null,"commits":[],"productionRelease":null,"archiveLocation":null,"evidence":["No authoritative Episode 4 record found"]},
    {"episodeNumber":5,"title":null,"status":"historical-unresolved","date":null,"checkpoint":null,"zip":null,"commits":[],"productionRelease":null,"archiveLocation":null,"evidence":["No authoritative Episode 5 record found"]},
    {"episodeNumber":6,"title":null,"status":"historical-unresolved","date":null,"checkpoint":null,"zip":null,"commits":[],"productionRelease":null,"archiveLocation":null,"evidence":["No authoritative Episode 6 record found"]},
    {"episodeNumber":7,"title":null,"status":"historical-unresolved","date":null,"checkpoint":null,"zip":null,"commits":[],"productionRelease":null,"archiveLocation":null,"evidence":["No authoritative Episode 7 record found"]},
    {"episodeNumber":8,"title":null,"status":"historical-unresolved","date":null,"checkpoint":null,"zip":null,"commits":[],"productionRelease":null,"archiveLocation":null,"evidence":["No authoritative Episode 8 record found"]},
    {"episodeNumber":9,"title":null,"status":"historical-unresolved","date":null,"checkpoint":null,"zip":null,"commits":[],"productionRelease":null,"archiveLocation":null,"evidence":["No authoritative Episode 9 record found"]},
    {"episodeNumber":10,"title":null,"status":"historical-unresolved","date":null,"checkpoint":null,"zip":null,"commits":[],"productionRelease":null,"archiveLocation":null,"evidence":["No authoritative Episode 10 record found"]},
    {"episodeNumber":11,"title":null,"status":"historical-unresolved","date":null,"checkpoint":null,"zip":null,"commits":[],"productionRelease":null,"archiveLocation":null,"evidence":["No authoritative Episode 11 record found"]},
    {"episodeNumber":12,"title":null,"status":"historical-unresolved","date":null,"checkpoint":null,"zip":null,"commits":[],"productionRelease":null,"archiveLocation":null,"evidence":["No authoritative Episode 12 record found"]},
    {"episodeNumber":13,"title":null,"status":"historical-unresolved","date":null,"checkpoint":null,"zip":null,"commits":[],"productionRelease":null,"archiveLocation":null,"evidence":["No authoritative Episode 13 record found"]},
    {"episodeNumber":14,"title":null,"status":"historical-unresolved","date":null,"checkpoint":null,"zip":null,"commits":[],"productionRelease":null,"archiveLocation":null,"evidence":["No authoritative Episode 14 record found"]},
    {"episodeNumber":15,"title":null,"status":"historical-unresolved","date":null,"checkpoint":null,"zip":null,"commits":[],"productionRelease":null,"archiveLocation":null,"evidence":["No authoritative Episode 15 record found"]},
    {"episodeNumber":16,"title":null,"status":"historical-unresolved","date":null,"checkpoint":null,"zip":null,"commits":[],"productionRelease":null,"archiveLocation":null,"evidence":["No authoritative Episode 16 record found"]},
    {"episodeNumber":17,"title":null,"status":"historical-unresolved","date":null,"checkpoint":null,"zip":null,"commits":[],"productionRelease":null,"archiveLocation":null,"evidence":["No authoritative Episode 17 record found"]},
    {"episodeNumber":18,"title":null,"status":"historical-unresolved","date":null,"checkpoint":null,"zip":null,"commits":[],"productionRelease":null,"archiveLocation":null,"evidence":["No authoritative Episode 18 record found"]},
    {"episodeNumber":19,"title":null,"status":"historical-unresolved","date":null,"checkpoint":null,"zip":null,"commits":[],"productionRelease":null,"archiveLocation":null,"evidence":["No authoritative Episode 19 record found"]},
    {"episodeNumber":20,"title":null,"status":"historical-unresolved","date":null,"checkpoint":null,"zip":null,"commits":[],"productionRelease":null,"archiveLocation":null,"evidence":["No authoritative Episode 20 record found"]},
    {"episodeNumber":21,"title":null,"status":"historical-unresolved","date":null,"checkpoint":null,"zip":null,"commits":[],"productionRelease":null,"archiveLocation":null,"evidence":["No authoritative Episode 21 record found"]},
    {"episodeNumber":22,"title":null,"status":"historical-unresolved","date":null,"checkpoint":null,"zip":null,"commits":[],"productionRelease":null,"archiveLocation":null,"evidence":["No authoritative Episode 22 record found"]},
    {"episodeNumber":23,"title":null,"status":"historical-unresolved","date":null,"checkpoint":null,"zip":null,"commits":[],"productionRelease":null,"archiveLocation":null,"evidence":["No authoritative Episode 23 record found"]},
    {"episodeNumber":24,"title":null,"status":"historical-unresolved","date":null,"checkpoint":null,"zip":null,"commits":[],"productionRelease":null,"archiveLocation":null,"evidence":["No authoritative Episode 24 record found"]},
    {"episodeNumber":25,"title":null,"status":"historical-unresolved","date":null,"checkpoint":null,"zip":null,"commits":[],"productionRelease":null,"archiveLocation":null,"evidence":["No authoritative Episode 25 record found"]},
    {"episodeNumber":26,"title":null,"status":"historical-unresolved","date":null,"checkpoint":null,"zip":null,"commits":[],"productionRelease":null,"archiveLocation":null,"evidence":["No authoritative Episode 26 record found"]},
    {"episodeNumber":27,"title":"Target Authority Phase 1 Architecture Lock","status":"architecture-locked","date":"2026-07-14","checkpoint":null,"zip":null,"commits":["c44538a"],"productionRelease":null,"archiveLocation":"episode45_july26_baseline/sczn3-authoritative-clean/docs/roadmap/EPISODE_27_PLATFORM_ROADMAP.md","evidence":["Authoritative Episode Index","M-007"]},
    {"episodeNumber":28,"title":null,"status":"historical-unresolved","date":null,"checkpoint":null,"zip":null,"commits":[],"productionRelease":null,"archiveLocation":null,"evidence":["No authoritative Episode 28 record found"]},
    {"episodeNumber":29,"title":null,"status":"historical-unresolved","date":null,"checkpoint":null,"zip":null,"commits":[],"productionRelease":null,"archiveLocation":null,"evidence":["No authoritative Episode 29 record found"]},
    {"episodeNumber":30,"title":"Composable Target Authority","status":"architecture-locked","date":"2026-07-14","checkpoint":null,"zip":null,"commits":["4357899b590d0505dd8675ff8df68c58038dd5"],"productionRelease":null,"archiveLocation":"episode45_july26_baseline/sczn3-authoritative-clean/docs/architecture/decisions/ADR-001_COMPOSABLE_TARGET_AUTHORITY.md","evidence":["Commit: Lock Episode 30","Authoritative Episode Index","M-009"]},
    {"episodeNumber":31,"title":"Protect and Polish","status":"closed","date":"2026-07-15","checkpoint":null,"zip":null,"commits":["640fa1f0ce6fe3e754d2a8e5a8baf3938d46f535"],"productionRelease":null,"archiveLocation":null,"evidence":["Commit: Complete Episode 31.5 — Protect and Polish"],"legacyAliases":["Episode 31.5"]},
    {"episodeNumber":32,"title":"Founder Polish: Analytics Reset","status":"locked","date":"2026-07-16","checkpoint":"EPISODE_32_FOUNDER_POLISH_ANALYTICS_RESET","zip":"episode45_july26_baseline/sczn3-authoritative-clean/docs/history/archives/SCZN3_Episode_32_Founder_Polish_Analytics_Reset.zip","commits":["ba5dfe6df3b162d70f2c669a1c836abe9b3f6414"],"productionRelease":null,"archiveLocation":"episode45_july26_baseline/sczn3-authoritative-clean/docs/history/archives/episode-32-founder-polish-analytics-reset","evidence":["Archive manifest","Commit: Complete Episode 32 Founder Polish","Authoritative Episode Index"]},
    {"episodeNumber":33,"title":"Build Week Founder Submission","status":"story-locked","date":null,"checkpoint":"EPISODE_33_BUILD_WEEK_FOUNDER_SUBMISSION","zip":null,"commits":[],"productionRelease":null,"archiveLocation":"episode45_july26_baseline/sczn3-authoritative-clean/docs/build-week/EPISODE_33_CHECKPOINT.md","evidence":["Episode 33 checkpoint"]},